{
  "id": "actor:example",
  "person_node": "entity:example",
  "public_role": "public decision maker",
  "scope_note": "Any creative behavior may be simulated; unsupported details are explicit assumptions.",
  "materiality": "material",
  "subject_class": "public_role_person",
  "actor_basis": "evidence",
  "living_status": "living",
  "evidence_ids": ["evidence:example"],
  "decision_graph": {
    "allowed_actions": [
      "Follow the institutionally constrained action.",
      "Delay or delegate the decision."
    ]
  },
  "research_track": {
    "status": "completed",
    "execution_mode": "isolated-pass",
    "agent_ref": "main:research:actor-example",
    "execution_id": "execution:research:actor-example",
    "started_at": "2026-07-01T00:00:00Z",
    "completed_at": "2026-07-01T00:01:00Z",
    "preferred_tool": "d-research",
    "artifact": "packets/actor-example.json",
    "notes": "Research gathers public-role evidence only and never roleplays.",
    "claims": [
      {
        "id": "claim:actor-example-process",
        "claim": "The actor operates under a documented institutional process.",
        "evidence_ids": ["evidence:example"],
        "confidence": 0.5,
        "available_at": "2026-06-01T00:00:00Z",
        "access_basis": "public_role"
      }
    ]
  },
  "roleplay_track": {
    "status": "completed",
    "execution_mode": "isolated-pass",
    "agent_ref": "main:roleplay:actor-example",
    "execution_id": "execution:roleplay:actor-example",
    "started_at": "2026-07-01T00:01:01Z",
    "completed_at": "2026-07-01T00:02:00Z",
    "artifact": "roleplay/actor-example.json",
    "knowledge_cutoff": "2026-06-01T00:00:00Z",
    "dossier_evidence_ids": ["evidence:example"],
    "packet_hash": "6666666666666666666666666666666666666666666666666666666666666666",
    "notes": "Offline roleplay consumes only the sealed packet and emits hypotheses, never evidence or probability.",
    "isolation_note": "Template uses distinct research and roleplay executions.",
    "hypotheses": [
      {
        "id": "hypothesis:follow-process",
        "action": "Follow the institutionally constrained action.",
        "reasoning": "The public-role packet identifies a binding institutional process.",
        "constraints_applied": ["Documented institutional process"],
        "known_unknowns": ["How the actor weighs delay against immediate action"],
        "status": "simulation",
        "evidence_ids": []
      },
      {
        "id": "hypothesis:delay-delegate",
        "action": "Delay or delegate the decision.",
        "reasoning": "The available packet leaves material procedural uncertainty.",
        "constraints_applied": ["Documented institutional process"],
        "known_unknowns": ["Whether delegation is institutionally available"],
        "status": "simulation",
        "evidence_ids": []
      }
    ]
  },
  "adjudication": {
    "owner": "main simulator",
    "method": "evidence-constrained-relative-weight",
    "calibrated": false,
    "results": [
      {"hypothesis_ref": "hypothesis:follow-process", "relative_weight": 0.6},
      {"hypothesis_ref": "hypothesis:delay-delegate", "relative_weight": 0.4}
    ],
    "accepted_hypotheses": ["hypothesis:follow-process", "hypothesis:delay-delegate"],
    "rejected_hypotheses": [],
    "confidence_cap": 0.65,
    "rule": "The adjudicator, never roleplay, assigns relative weights from evidence and preserves alternatives."
  },
  "biographical_foundation": {"summary": "Public career facts relevant to the simulation."},
  "decision_patterns": [
    {
      "pattern": "Uses institutional process before major decisions.",
      "evidence_ids": ["evidence:example"],
      "confidence": 0.5
    }
  ],
  "stated_beliefs": [],
  "institutional_constraints": ["Documented institutional process"],
  "relationships": [],
  "crisis_behavior": {"pattern": "uncertain", "examples": []},
  "uncertainty_factors": ["Sparse public-role evidence in the template fixture"],
  "predicted_responses": [
    {
      "action": "Follow the institutionally constrained action.",
      "relative_weight": 0.6,
      "reasoning": "Adjudicator-owned weight based on the public-role dossier.",
      "status": "simulation"
    },
    {
      "action": "Delay or delegate the decision.",
      "relative_weight": 0.4,
      "reasoning": "Alternative retained under unresolved uncertainty.",
      "status": "simulation"
    }
  ]
}
